{
  "schema_version": 1,
  "intent_id": "intent_fixture",
  "session_id": "session_fixture",
  "source": "catalog_action",
  "requested_mode": "diagnose",
  "text": null,
  "action_id": "health.lighting.diagnose",
  "action_version": "1.0.0",
  "parameters": {
    "affected_controls": "both",
    "nvidia_power_correlation": "suspected"
  },
  "constraints": ["do not execute during preparation"],
  "created_at": "2026-08-05T12:00:00Z"
}
